{
  "$schema": "../schema/matchups.schema.json",
  "champion": "Amumu",
  "role": "jungle",
  "threatWeights": {
    "cleanse": 2,
    "spell-shield": 2,
    "anti-engage": 2,
    "untargetable": 1.5,
    "high-mobility": 1.5,
    "percent-hp-damage": 1.5,
    "early-invader": 1.5,
    "true-damage": 1,
    "kite": 1,
    "early-game": 1,
    "invisibility": 0.5
  },
  "genericAdvice": {
    "cleanse": { "text": "They can cleanse CC: don't open with Curse of the Sad Mummy on them — catch someone else or wait for the cleanse to be used." },
    "spell-shield": { "text": "Spell shield blocks Bandage Toss: bait it out (or Q a different target) before engaging." },
    "anti-engage": { "text": "Anti-engage tools punish your dive: flank or wait until their peel is used before you R." },
    "untargetable": { "text": "Untargetable/dodge tools can waste your R: hold it until they have used them." },
    "high-mobility": { "text": "High mobility: hit them with R from fog or a flank — a straight Bandage Toss is easy to dodge." },
    "percent-hp-damage": { "text": "Percent-HP damage shreds tanks: don't stand in front of them for long fights alone." },
    "early-invader": { "text": "Early invader: ward your buff entrances and avoid 1v1s before level 6; ping your laners to cover." },
    "true-damage": { "text": "True damage ignores your resistances: tank stacking helps less, peel for your carries instead." },
    "kite": { "text": "Kiting carry: you need Bandage Toss or R to land first — flank instead of walking at them." },
    "early-game": { "text": "Strong early: track their jungler, farm efficiently and arrive at fights after your level 6." }
  },
  "matchups": {
    "LeeSin": {
      "difficulty": 4,
      "threat": 4,
      "phaseAdvantage": { "early": "them", "mid": "even", "late": "me" },
      "powerSpikes": [
        { "kind": "level", "level": 2, "note": "Strong level 2-3 duels and invades." },
        { "kind": "level", "level": 6, "note": "Dragon's Rage can kick you away from your engage target." }
      ],
      "dangerAbilities": [
        { "key": "R", "name": "Dragon's Rage", "note": "Kicks you out of position or into your team." },
        { "key": "Q", "name": "Sonic Wave", "note": "Follow-up dash for ganks and invades." },
        { "key": "W", "name": "Safeguard", "note": "Shield/dash to allies and wards — escapes after you engage." }
      ],
      "tips": [
        { "text": "Avoid 1v1s with him before level 6; he out-duels you early." },
        { "text": "Ward the entrance to your raptors/buff side he is likely to invade." },
        { "text": "Match his ganks by counter-ganking; your R + laner wins 2v2 fights." },
        { "text": "Late game he falls off; play for teamfights." }
      ],
      "itemAdjustments": [
        { "item": 3047, "name": "Plated Steelcaps", "note": "Armor against his physical damage if he is ahead.", "confidence": "medium" }
      ],
      "runeAdjustments": [],
      "threatTags": ["early-invader", "early-game", "high-mobility"],
      "jungle": { "invadeRisk": "high", "strongLevels": [2, 3], "note": "Enemy Lee Sin is strong level 2–3 — avoid his side early; ward his raptors/buff entrance." },
      "lastReviewedPatch": "draft",
      "confidence": "medium"
    },
    "Graves": {
      "difficulty": 4,
      "threat": 4,
      "phaseAdvantage": { "early": "them", "mid": "them", "late": "even" },
      "powerSpikes": [
        { "kind": "level", "level": 3, "note": "Fast clear + strong duel — common early invader." },
        { "kind": "other", "note": "First lethality item makes his burst very high." }
      ],
      "dangerAbilities": [
        { "key": "W", "name": "Smoke Screen", "note": "Nearsight hides him while he shoots you." },
        { "key": "E", "name": "Quickdraw", "note": "Dash + armor; he kites your Bandage Toss." }
      ],
      "tips": [
        { "text": "Never fight him alone in your jungle early; call your laners." },
        { "text": "Ward entrances to your camps — he tends to take camps while farming." },
        { "text": "In teamfights flank him; he kites well from the front." }
      ],
      "itemAdjustments": [
        { "item": 3047, "name": "Plated Steelcaps", "note": "Armor against his burst." }
      ],
      "runeAdjustments": [],
      "threatTags": ["early-invader", "kite", "burst"],
      "jungle": { "invadeRisk": "high", "strongLevels": [3, 4], "note": "Graves farms fast and likes to steal camps — ward your second buff and avoid isolated 1v1s." },
      "lastReviewedPatch": "draft",
      "confidence": "medium"
    },
    "Viego": {
      "difficulty": 3,
      "threat": 3,
      "phaseAdvantage": { "early": "even", "mid": "even", "late": "even" },
      "powerSpikes": [
        { "kind": "level", "level": 6, "note": "Heartbreaker execute + possession resets in fights." }
      ],
      "dangerAbilities": [
        { "key": "P", "name": "Sovereign's Domination", "note": "Possessing a dead champion resets him — clean up fights fast." },
        { "key": "W", "name": "Spectral Maw", "note": "Dash stun." },
        { "key": "E", "name": "Harrowed Path", "note": "Camouflage in terrain mist: hard to target with Bandage Toss." }
      ],
      "tips": [
        { "text": "Chain CC on him after the first kill in a fight to stop resets." },
        { "text": "Keep R for when he possesses someone — he can't escape in that window." },
        { "text": "Contest scuttle with your laners; he's weak to coordinated fights." }
      ],
      "itemAdjustments": [],
      "runeAdjustments": [],
      "threatTags": ["percent-hp-damage", "untargetable"],
      "jungle": { "invadeRisk": "medium", "strongLevels": [3], "note": "Viego can contest early but prefers farming; normal warding is enough." },
      "lastReviewedPatch": "draft",
      "confidence": "low"
    },
    "Vi": {
      "difficulty": 3,
      "threat": 3,
      "phaseAdvantage": { "early": "them", "mid": "even", "late": "me" },
      "powerSpikes": [
        { "kind": "level", "level": 3, "note": "Strong level 3 ganks." },
        { "kind": "level", "level": 6, "note": "Cease and Desist: unstoppable point-click knockup on your carry." }
      ],
      "dangerAbilities": [
        { "key": "R", "name": "Cease and Desist", "note": "Can't be stopped by your CC while charging." },
        { "key": "W", "name": "Denting Blows", "note": "% max HP damage and armor shred against you." }
      ],
      "tips": [
        { "text": "Peel your carry from her R with your own Q/R after she lands." },
        { "text": "Track her start: she likes level 3 ganks on the side she ends on." },
        { "text": "You out-teamfight her later; avoid early 1v1s." }
      ],
      "itemAdjustments": [],
      "runeAdjustments": [],
      "threatTags": ["point-click-cc", "percent-hp-damage"],
      "jungle": { "invadeRisk": "medium", "strongLevels": [3], "note": "Vi looks for level 3 ganks — warn the lane on her end side." },
      "lastReviewedPatch": "draft",
      "confidence": "medium"
    },
    "Kayn": {
      "difficulty": 2,
      "threat": 3,
      "phaseAdvantage": { "early": "me", "mid": "even", "late": "them" },
      "powerSpikes": [
        { "kind": "other", "note": "Form transformation (Rhaast = anti-tank healing, Shadow Assassin = burst)." }
      ],
      "dangerAbilities": [
        { "key": "R", "name": "Umbral Trespass", "note": "Untargetable inside a champion — dodges your R." },
        { "key": "E", "name": "Shadow Step", "note": "Walks through walls; ganks from unexpected angles." }
      ],
      "tips": [
        { "text": "He is weak before his form — gank early to keep his lanes from feeding him orbs." },
        { "text": "Against Rhaast, avoid long fights (heals off % of your health)." },
        { "text": "Wait for Umbral Trespass to be used before your R." }
      ],
      "itemAdjustments": [],
      "runeAdjustments": [],
      "threatTags": ["percent-hp-damage", "untargetable"],
      "jungle": { "invadeRisk": "low", "strongLevels": [], "note": "Kayn farms early; low invade risk." },
      "lastReviewedPatch": "draft",
      "confidence": "medium"
    },
    "Khazix": {
      "difficulty": 2,
      "threat": 2,
      "phaseAdvantage": { "early": "them", "mid": "even", "late": "me" },
      "powerSpikes": [
        { "kind": "level", "level": 6, "note": "Evolution choices + Void Assault invisibility." }
      ],
      "dangerAbilities": [
        { "key": "Q", "name": "Taste Their Fear", "note": "Bonus damage on isolated targets — stay near allies." },
        { "key": "R", "name": "Void Assault", "note": "Invisibility; your R can still hit him if he's nearby." }
      ],
      "tips": [
        { "text": "Stay near walls/minions or allies to avoid being isolated." },
        { "text": "You are tanky — he struggles to kill you; peel for your carries." },
        { "text": "Use Despair/R area when he goes invisible nearby." }
      ],
      "itemAdjustments": [],
      "runeAdjustments": [],
      "threatTags": ["burst", "invisibility"],
      "jungle": { "invadeRisk": "medium", "strongLevels": [3], "note": "Kha'Zix can invade an isolated jungler; avoid fighting alone." },
      "lastReviewedPatch": "draft",
      "confidence": "medium"
    },
    "Elise": {
      "difficulty": 4,
      "threat": 4,
      "phaseAdvantage": { "early": "them", "mid": "even", "late": "me" },
      "powerSpikes": [
        { "kind": "level", "level": 3, "note": "Very strong level 3 ganks and duels." }
      ],
      "dangerAbilities": [
        { "key": "E", "name": "Cocoon", "note": "Stun skillshot that sets up her burst." },
        { "key": "E", "name": "Rappel", "note": "Spider-form untargetable: dodges Bandage Toss and R." }
      ],
      "tips": [
        { "text": "Expect early ganks on your lanes — warn them about her first gank timing." },
        { "text": "Hold R until Rappel is on cooldown." },
        { "text": "She falls off — survive early and win teamfights." }
      ],